{
  "schemaVersion": "1.0.0",
  "asOf": "2026-09-03",
  "policyVersion": "raidbench-paid-answer-v2",
  "casesPerProduct": 3,
  "blueprints": [
    {
      "productId": "poe2-build-decision-review",
      "gameId": "poe2",
      "gameVersion": "Path of Exile 2 update 0.5.5 Forbidden Rites; source check 2026-09-03",
      "questionText": "My Lightning Arrow Deadeye stalls in high-intensity Expedition encounters. What should I verify before spending a 150 Divine budget?",
      "inputs": {
        "currentPatch": "0.5.5 Forbidden Rites",
        "buildDescription": "Level 96 Lightning Arrow Deadeye; the player reports four deaths and an eleven-minute average across ten comparable Expedition runs, but supplied no live trade-price claim.",
        "targetContent": "High-intensity Expedition encounters",
        "observedProblem": "Damage uptime collapses after movement and recovery pressure begins.",
        "budget": "150 Divine maximum; do not infer current item prices."
      },
      "missingField": "buildDescription",
      "evidenceSourceIds": ["poe2-official-patch-notes", "poe2-steam-news"],
      "answerFocus": "Separate observed performance from inferred build mechanics, identify the first measurement to retest, and do not prescribe an item or live price absent inspectable evidence."
    },
    {
      "productId": "palworld-base-progression-review",
      "gameId": "palworld",
      "gameVersion": "Palworld version 1.0; source check 2026-09-03",
      "questionText": "Why does my dedicated-server ore base stop filling storage while I am away, and what is the safest first test?",
      "inputs": {
        "gameVersion": "1.0",
        "serverType": "Dedicated server with no production-changing mods reported",
        "currentGoal": "Keep ore production stable during one thirty-minute observation window",
        "baseOrProgressionState": "Second base with four assigned miners, four transport workers, two storage containers, and a clear route according to the player",
        "observedProblem": "Storage remains unchanged after the player leaves the area"
      },
      "missingField": "serverType",
      "evidenceSourceIds": ["palworld-official-news", "palworld-steam-news"],
      "answerFocus": "Recommend a one-variable observation plan and distinguish player-reported state from any unverified simulation or pathing mechanic."
    },
    {
      "productId": "project-zomboid-save-plan-review",
      "gameId": "project-zomboid",
      "gameVersion": "Project Zomboid stable build 42.20.4; source check 2026-09-03",
      "questionText": "How should I test a mid-save zombie-setting change without risking my long-running modded world?",
      "inputs": {
        "currentBuild": "42.20.4 stable",
        "requestedChange": "Change several related zombie population and behavior settings",
        "modList": "12 enabled mods; exact list supplied in the benchmark attachment",
        "saveImportance": "Long-running important world",
        "backupStatus": "Backup copied and successfully test-loaded"
      },
      "missingField": "backupStatus",
      "evidenceSourceIds": ["project-zomboid-official-news", "project-zomboid-steam-news"],
      "answerFocus": "Use the planning score only as a test-sequencing aid; do not express it as a corruption probability or promise that a backup will restore correctly.",
      "calculationFixture": {
        "toolId": "project-zomboid-save-change-risk",
        "inputs": { "saveImportance": 5, "modCount": 12, "changeScope": 3, "compatibilityConfidence": 3, "backupReady": 1 },
        "assertions": [
          { "calculationId": "save_change_risk_score", "label": "Planning risk score", "path": "primary", "expected": 62, "tolerance": 0 }
        ]
      }
    },
    {
      "productId": "escape-from-tarkov-loadout-route-review",
      "gameId": "escape-from-tarkov",
      "gameVersion": "Escape from Tarkov publisher sources checked 2026-09-03; exact gameplay patch not asserted",
      "questionText": "Can my current account afford three copies of this task loadout while preserving a fifteen percent restock reserve?",
      "inputs": {
        "currentPatch": "Publisher source check 2026-09-03; exact patch identifier unavailable",
        "mode": "PvP",
        "accountAccess": "Level 20 account; player-entered trader and market values only",
        "mapOrTask": "Player-named task route; no route-mechanic claim requested",
        "budget": 2000000,
        "availableEquipment": { "weaponCost": 120000, "magazines": 4, "magazineCost": 8000, "rounds": 160, "roundCost": 600, "armorCost": 150000, "supportCost": 90000, "copies": 3, "reservePercent": 15 }
      },
      "missingField": "accountAccess",
      "evidenceSourceIds": ["escape-from-tarkov-official-forum", "escape-from-tarkov-steam-news"],
      "answerFocus": "Calculate only from the player's entered costs, explicitly avoid live-price and ammunition-performance claims, and state that the exact patch identifier remains a limitation.",
      "calculationFixture": {
        "toolId": "escape-from-tarkov-loadout-budget",
        "inputs": { "weaponCost": 120000, "magazines": 4, "magazineCost": 8000, "rounds": 160, "roundCost": 600, "armorCost": 150000, "supportCost": 90000, "copies": 3, "reservePercent": 15, "availableBudget": 2000000 },
        "assertions": [
          { "calculationId": "protected_batch_budget", "label": "Protected batch budget", "path": "primary", "expected": 1683600, "tolerance": 0 },
          { "calculationId": "cost_per_kit", "label": "Cost per kit", "path": "metrics.0.value", "expected": 488000, "tolerance": 0 },
          { "calculationId": "current_shortfall", "label": "Current shortfall", "path": "metrics.2.value", "expected": 0, "tolerance": 0 }
        ]
      }
    },
    {
      "productId": "ark-survival-ascended-roster-plan-review",
      "gameId": "ark-survival-ascended",
      "gameVersion": "ARK: Survival Ascended publisher source check 2026-09-03",
      "questionText": "What material budget should I stage for eighteen roster saddles, two replacements, and a ten percent reserve on this server?",
      "inputs": {
        "gameVersion": "Publisher source check 2026-09-03",
        "map": "Player-specified current map",
        "serverRates": "Player-entered server settings; no official-rate assumption",
        "activeMods": "No crafting-cost mods reported",
        "targetCreatureOrEncounter": "Eighteen-creature roster with two replacement saddles",
        "currentResources": { "hidePerSaddle": 350, "fiberPerSaddle": 180, "metalPerSaddle": 60, "reservePercent": 10 }
      },
      "missingField": "serverRates",
      "evidenceSourceIds": ["ark-survival-ascended-official-news", "ark-survival-ascended-steam-news"],
      "answerFocus": "Use only the blueprint values supplied by the player and do not infer official rates, boss requirements, crafting-skill effects, or mod behavior.",
      "calculationFixture": {
        "toolId": "ark-survival-ascended-roster-materials",
        "inputs": { "creatures": 18, "replacements": 2, "hidePerSaddle": 350, "fiberPerSaddle": 180, "metalPerSaddle": 60, "reservePercent": 10 },
        "assertions": [
          { "calculationId": "saddles_budgeted", "label": "Saddles budgeted", "path": "primary", "expected": 20, "tolerance": 0 },
          { "calculationId": "hide_total", "label": "Hide total", "path": "metrics.0.value", "expected": 7700, "tolerance": 0 },
          { "calculationId": "fiber_total", "label": "Fiber total", "path": "metrics.1.value", "expected": 3960, "tolerance": 0 },
          { "calculationId": "metal_total", "label": "Metal total", "path": "metrics.2.value", "expected": 1320, "tolerance": 0 }
        ]
      }
    },
    {
      "productId": "warframe-build-progression-review",
      "gameId": "warframe",
      "gameVersion": "Warframe Update 43.5 Amir's Shockwave; source check 2026-09-03",
      "questionText": "Which of my two upgrades deserves scarce resources first for the target activity I described?",
      "inputs": {
        "currentPatch": "Update 43.5 Amir's Shockwave",
        "accountProgress": "Returning account with the target activity unlocked",
        "loadout": "Player supplied the current frame, weapon, and mod configuration; no hidden-stat claim requested",
        "targetActivity": "Player-specified repeatable activity",
        "observedProblem": "The measured problem recurs in the same activity",
        "availableResources": "Enough for one upgrade; player-scored comparison attached"
      },
      "missingField": "loadout",
      "evidenceSourceIds": ["warframe-official-patch-notes", "warframe-steam-news"],
      "answerFocus": "Treat the scores as player judgments, explain why the higher weighted score wins, and avoid claims about universal meta strength or unverified mod behavior.",
      "calculationFixture": {
        "toolId": "warframe-upgrade-priority-comparator",
        "inputs": { "optionA": "Upgrade A", "optionB": "Upgrade B", "problemFitA": 4, "problemFitB": 3, "reuseA": 3, "reuseB": 5, "efficiencyA": 3, "efficiencyB": 4, "confidenceA": 4, "confidenceB": 3 },
        "assertions": [
          { "calculationId": "upgrade_a_score", "label": "Upgrade A score", "path": "metrics.0.value", "expected": 70, "tolerance": 0 },
          { "calculationId": "upgrade_b_score", "label": "Upgrade B score", "path": "metrics.1.value", "expected": 75, "tolerance": 0 },
          { "calculationId": "upgrade_score_gap", "label": "Score gap", "path": "metrics.2.value", "expected": 5, "tolerance": 0 }
        ]
      }
    },
    {
      "productId": "once-human-scenario-build-review",
      "gameId": "once-human",
      "gameVersion": "Once Human version 3.0.5; source check 2026-09-03",
      "questionText": "Which of these two scenario paths better fits my schedule, group, goal, and confirmed carryover information?",
      "inputs": {
        "currentVersion": "3.0.5",
        "currentScenario": "Scenario A",